{
  "schema_version": "2.0",
  "issue_id": "t19",
  "role": "verifier",
  "phase": "verify_post_merge",
  "status": "COMPLETE",
  "reached_state": "verified",
  "evidence": {
    "evidence_type": "merge_verification",
    "smoke_tests": {
      "total": 21,
      "passed": 21,
      "failed": 0
    },
    "merge_sha": "441a521fe117ac42703f3963d823a075cffad2fb",
    "regressions_detected": []
  },
  "artifacts": {
    "files_written": [
      "docs/state/outputs/t19_verifier_verify_post_merge.json"
    ],
    "platform_issue": 74,
    "output_path": "docs/state/outputs/t19_verifier_verify_post_merge.json"
  },
  "error": null,
  "next_action": null,
  "timestamp": "2026-10-08T15:14:21Z",
  "retry_count": 0
}
